Catalog#,Artist,Title,Label,Format,Rating,Released,release_id,CollectionFolder,Date Added,Collection Media Condition,Collection Sleeve Condition,Collection Notes
3DOT-003,Periphery (3),Periphery V: Djent Is Not A Genre,3 Dot Recordings,"2xLP, Album, Ltd, Cob",,2023,26533118,Metal,2024-05-09 10:15:14,Near Mint (NM or M-),,
"SP 4313, SP-4313",Cat Stevens,Teaser And The Firecat,"A&M Records, A&M Records","LP, Album, Pit",,1971,2944827,Rock,2024-10-18 15:26:55,Good Plus (G+),,
"SP-4391, SP4391",Cat Stevens,Foreigner,"A&M Records, A&M Records","LP, Album, Pit",,1973,1362675,Rock,2024-10-18 15:26:17,Very Good (VG),,
AS-9205,Genesis,Trespass,"ABC Records, Impulse!","LP, Album, Gat",,1971,1643077,Rock,2024-07-05 13:15:20,Very Good Plus (VG+),,
2147-1,The Rolling Stones,England's Newest Hit Makers,ABKCO,"LP, Album, Mono, RE, Ice",,2023,27607602,Rock,2024-01-09 16:46:41,Mint (M),,
ANR-1-1030,Rush,Moving Pictures,Anthem (5),"LP, Album, Mas",,1981,589603,Rock,2024-07-10 08:25:26,Good Plus (G+),,
PCS 7067/8,The Beatles,The Beatles,Apple Records,"2xLP, Album, Num",,1968,1113362,Rock,2024-03-18 10:30:10,Good (G),,
"PCS 7088, 0094638246817",The Beatles,Abbey Road,"Apple Records, Apple Records","LP, Album, RE, RM",,2016,9269057,Rock,2024-02-28 09:31:51,Near Mint (NM or M-),,
"PCS 7096, 0094638247210",The Beatles,Let It Be,"Apple Records, Apple Records","LP, Album, RE, 180",,2017,11092658,Rock,2024-02-28 09:32:24,Near Mint (NM or M-),,
29 039 5,The Alan Parsons Project,Eye In The Sky,Arista,"LP, Album, Club",,1982,1243960,Rock,2024-06-04 19:38:46,Very Good Plus (VG+),,
AL9-8384,The Alan Parsons Project,Stereotomy,Arista,"LP, Album, Ind",,1985,2142930,Rock,2024-08-18 13:56:29,Very Good Plus (VG+),,
90125-1,Yes,90125,ATCO Records,"LP, Album, SP ",,1983,1257022,Rock,2024-06-04 19:32:44,Very Good Plus (VG+),,
SD 2-401,Genesis,The Lamb Lies Down On Broadway,ATCO Records,"2xLP, Album, Mon",,1974,3919365,Rock,2024-08-18 13:50:33,Very Good Plus (VG+),,
SD 36-117,Focus (2),Mother Focus,ATCO Records,"LP, Album, PRC",,1975,1504931,Rock,2024-06-04 19:43:44,Very Good Plus (VG+),,
SD 36-144,Genesis,Wind & Wuthering,ATCO Records,"LP, Album, PR-",,1977,847918,Rock,2024-07-20 16:52:19,Very Good Plus (VG+),,
SD 38-149,Pete Townshend,All The Best Cowboys Have Chinese Eyes,ATCO Records,"LP, Album, Spe",,1982,1104330,Rock,2024-05-26 17:49:39,Very Good Plus (VG+),,
075678627750,Kelly Clarkson,Chemistry ,Atlantic,"LP, Album, Ltd, Oli",,2023,27502041,Pop,2024-04-19 10:11:15,Near Mint (NM or M-),,
588171,Led Zeppelin,Led Zeppelin,Atlantic,"LP, Album, Tur",,1969,1218217,Rock,2024-03-18 10:16:03,Good (G),,
R1 73788,Yes,The Yes Album,Atlantic,"LP, Album, RE, GZ ",,0,23205782,Rock,2024-07-16 19:02:25,Very Good Plus (VG+),,
SD 16014,Genesis,Duke,Atlantic,"LP, Album, SRC",,1980,513538,Rock,2024-07-10 08:21:36,Very Good Plus (VG+),,
SD 16018,AC/DC,Back In Black,Atlantic,"LP, Album, Whi",,1980,8008717,Rock,2024-06-04 19:50:23,Good (G),,
SD 16019,Yes,Drama,Atlantic,"LP, Album, AR,",,1980,1122757,Rock,2024-06-14 10:40:07,Very Good Plus (VG+),,
SD 18103,Yes,Yesterdays,Atlantic,"LP, Comp, GRT",,1975,800548,Rock,2024-06-14 10:37:39,Very Good Plus (VG+),,
SD 18122,Yes,Relayer,Atlantic,"LP, Album, Hub",,1974,755646,Rock,2024-06-05 14:02:26,Very Good Plus (VG+),,
SD 18154,Steve Howe,Beginnings,Atlantic,"LP, Album, Pre",,1975,2032967,Rock,2024-10-16 13:21:54,Very Good Plus (VG+),,
SD 19106,Yes,Going For The One,Atlantic,"LP, Album, Spe",,1977,476246,Rock,2024-06-04 19:27:57,Very Good Plus (VG+),,
SD 19173,Genesis,...And Then There Were Three...,Atlantic,"LP, Album, SP ",,1978,5223339,Rock,2024-07-20 16:50:29,Very Good Plus (VG+),,
SD 19202,Yes,Tormato,Atlantic,"LP, Album, PRC",,1978,1329918,Rock,2024-06-04 19:26:32,Very Good Plus (VG+),,
SD 19313,Genesis,Abacab,Atlantic,"LP, Album, A",,1981,2769874,Rock,2024-08-18 13:48:25,Very Good Plus (VG+),,
SD 2-510,Yes,Yesshows,Atlantic,"2xLP, Album, Spe",,1980,1179206,Rock,2024-06-04 19:35:52,Good Plus (G+),,
SD 2-9002,Genesis,Seconds Out,Atlantic,"2xLP, Album, Mon",,1977,576847,Rock,2024-06-14 10:42:41,Very Good (VG),,
SD 2-908,Yes,Tales From Topographic Oceans,Atlantic,"2xLP, Album, Spe",,1973,6429449,Rock,2024-05-26 17:31:39,Very Good (VG),,
SD 7211,Yes,Fragile,Atlantic,"LP, Album, PR ",,1972,4861360,Rock,2024-11-23 18:15:10,Near Mint (NM or M-),,
SD 7244,Yes,Close To The Edge,Atlantic,"LP, Album, RI ",,1972,756646,Rock,2024-05-26 17:43:09,Very Good Plus (VG+),,
"2401002, 2401 002",Led Zeppelin,Led Zeppelin III,"Atlantic, Atlantic","LP, Album, Gat",,1970,2019920,Rock,2024-03-18 11:06:07,Fair (F),,
"588198, 588 198",Led Zeppelin,Led Zeppelin II,"Atlantic, Atlantic","LP, Album, M/Print, Wre",,1969,1846223,Rock,2024-02-04 17:45:27,Very Good (VG),,
"80116-1, 7 80116-1",Genesis,Genesis,"Atlantic, Atlantic","LP, Album, SP ",,1983,1028168,Rock,2024-08-18 13:53:21,Very Good Plus (VG+),,
"K 50014, K50014",Led Zeppelin,Houses Of The Holy,"Atlantic, Atlantic","LP, Album, Gat",,1973,455077,Rock,2024-02-04 17:51:08,Very Good (VG),,
"N° 50.008, 50 008",Led Zeppelin,Untitled,"Atlantic, Atlantic","LP, Album",,1971,766941,Rock,2024-01-09 16:49:16,Mint (M),,
"SD 16029, SD-16029",Phil Collins,Face Value,"Atlantic, Atlantic","LP, Album, Mon",,1981,1014007,Rock,2024-09-18 08:47:46,Very Good Plus (VG+),,
ATO0654,Black Pumas,Chronicles Of A Diamond,ATO Records,"LP, Album, Gol",,2023,28722319,Rock,2024-01-25 08:03:40,Near Mint (NM or M-),,
AF0026,Meshuggah,Immutable,Atomic Fire,"2xLP, Album",,2022,22710050,Metal,2024-02-28 09:36:53,Near Mint (NM or M-),,
BCR055,Hellbound Glory,Nobody Knows You,BCR Los Angeles,"LP, Album, Ltd, Opa",,2022,24689888,Folk / Country,2024-01-26 19:46:33,Near Mint (NM or M-),,
"MS 2042, MS-2042",The Mothers,Fillmore East - June 1971,"Bizarre Records, Reprise Records","LP, Album, San",,1971,1770866,Rock,2024-05-26 17:52:22,Very Good Plus (VG+),,
RS 6356,Frank Zappa,Hot Rats,"Bizarre Records, Reprise Records","LP, Album, Gat",,1969,584013,Rock,2024-06-04 19:41:40,Very Good Plus (VG+),,
"BGM0003, BGM0003LP7",Code Orange (3),The Above,"Blue Grape Music, Blue Grape Music","LP, Album, Ltd, Pin",,2023,29148115,Metal,2024-04-19 10:16:29,Near Mint (NM or M-),,
"BST 84279, B0020644-01",Herbie Hancock,Speak Like A Child,"Blue Note, UMe","LP, Album, RE, RM, Gat",,2014,6149404,Jazz,2024-02-28 09:03:58,Near Mint (NM or M-),,
"4859545, 00602448595454, BST 84342, 84342",Grant Green,Green Is Beautiful,"Blue Note, UMe, Blue Note, UMe, Blue Note, Blue Note","LP, Album, RE, 180",,2023,25828138,Jazz,2024-04-28 15:45:03,Near Mint (NM or M-),,
86 185 IT,Uriah Heep,Demons And Wizards,"Bronze, Island Records","LP, Album, Gat",,1972,391003,Rock,2024-07-05 13:18:43,Very Good (VG),,
CANDLE643952,Darkest Era,Wither On The Vine,"Candlelight Records, Spinefarm Records","LP, Album",,2022,29254513,Metal,2024-02-02 16:10:50,Mint (M),,
DT 2545,The Beach Boys,Best Of The Beach Boys,Capitol Records,"LP, Comp, Scr",,1966,2551351,Rock,2024-02-04 17:23:25,Very Good (VG),,
ST-11696,Gentle Giant,The Missing Piece,Capitol Records,"LP, Album, Win",,1977,2092714,Rock,2024-07-16 18:58:02,Very Good Plus (VG+),,
none,Darius Rucker,Carolyn's Boy,Capitol Records Nashville,"LP, Album, Bla",,2023,29012905,Folk / Country,2024-07-05 13:42:09,Near Mint (NM or M-),,
"ST 2576, ST-2576",The Beatles,Revolver,"Capitol Records, Capitol Records","LP, Album, Los",,1966,1498484,Rock,2024-03-18 10:22:51,Very Good (VG),,
"SMAS 2653, SMAS-2653, 2653",The Beatles,Sgt. Pepper's Lonely Hearts Club Band,"Capitol Records, Capitol Records, Capitol Records","LP, Album, Gat",,1968,1334394,Rock,2024-05-01 10:06:16,Very Good Plus (VG+),,
"C1 0777 48062 1 3, C1-48062",The Beatles,Magical Mystery Tour,"Capitol Records, Parlophone, Apple Records, Capitol Records","LP, Album, Ltd, RE",,1995,714570,Rock,2024-04-08 10:40:44,Very Good Plus (VG+),,
137642,Ray Conniff And The Singers,Jean,CBS,"LP, Album",,1969,7403526,Other,2024-02-28 09:13:44,Fair (F),,
M 35828,"Wolfgang Amadeus Mozart, Murray Perahia, English Chamber Orchestra",Mozart:  Piano Concertos Nos. 12 & 27,CBS Masterworks,LP,,1980,2875852,Classical,2024-05-24 09:49:02,Very Good Plus (VG+),,
"61717, S61717",The Schneider Quartet,Waltzes From Old Vienna,"CBS, CBS","LP, Album",,1976,15941178,Classical,2024-01-26 19:40:54,Good Plus (G+),,
CAS 1052,Genesis,Nursery Cryme,Charisma,"LP, Album, Son",,1972,1606342,Rock,2024-11-21 10:58:47,Very Good (VG),,
"CAS 1058, CAS-1058",Genesis,Foxtrot,"Charisma, Charisma","LP, Album, Gat",,1972,1605811,Rock,2024-07-16 18:55:05,Good (G),,
RCV1 187964,Genesis,A Trick Of The Tail,"Charisma, Rhino Records (2), Atlantic","LP, Album, Ltd, RE, RP, Yel",,2021,17023353,Rock,2024-07-05 13:13:57,Very Good Plus (VG+),,
CHE 1301,Jethro Tull,A,Chrysalis,"LP, Album, San",,1980,1874966,Rock,2024-06-14 10:51:01,Very Good (VG),,
CHR 1040,Jethro Tull,A Passion Play,Chrysalis,"LP, Album, Gat",,1973,1276465,Rock,2024-06-04 19:48:24,Very Good Plus (VG+),,
CHR 1067,Jethro Tull,War Child,Chrysalis,"LP, Album",,1974,12466850,Rock,2024-05-26 17:35:41,Very Good (VG),,
CHR 1082,Jethro Tull,Minstrel In The Gallery,Chrysalis,"LP, Album, Ter",,1975,1583609,Rock,2024-07-16 18:52:14,Good Plus (G+),,
CHR 1238,Jethro Tull,Stormwatch,Chrysalis,"LP, Album, San",,1979,1329972,Rock,2024-06-04 19:30:01,Very Good Plus (VG+),,
FV 41461,Jethro Tull,Under Wraps,Chrysalis,"LP, Album",,1984,2101615,Rock,2024-06-14 10:47:53,Very Good Plus (VG+),,
"CHR-1175, CHR 1175",Jethro Tull,Heavy Horses,"Chrysalis, Chrysalis","LP, Album, San",,1978,652122,Rock,2024-07-10 08:29:17,Very Good Plus (VG+),,
CL 883,Erroll Garner,Concert By The Sea,Columbia,"LP, Album, Mono",,1956,636663,Uncategorized,2024-04-19 10:32:03,Poor (P),,
CL 883,Erroll Garner,Concert By The Sea,Columbia,"LP, Album",,1956,8632352,Jazz,2024-05-24 09:57:07,Fair (F),,
CS 8230,Ashley Miller,The Famous Radio City Music Hall Organ,Columbia,"LP, Album, Fid",,0,8272765,Uncategorized,2024-01-08 17:25:04,Very Good (VG),,
FC 36339,Journey,Departure,Columbia,"LP, Album",,1980,1763882,Rock,2024-06-04 19:52:18,Very Good Plus (VG+),,
JC 35257,Frank Marino & Mahogany Rush,Live,Columbia,"LP, Album, Pit",,1978,2010166,Rock,2024-03-21 10:36:32,Very Good Plus (VG+),,
JC 35388,David Gilmour,David Gilmour,Columbia,"LP, Album",,1978,1361540,Rock,2024-06-04 19:54:13,Very Good Plus (VG+),,
JC 35388,David Gilmour,David Gilmour,Columbia,"LP, Album",,1978,7728427,Rock,2024-09-18 08:45:52,Very Good Plus (VG+),,
KCS 9463,Bob Dylan,Bob Dylan's Greatest Hits,Columbia,"LP, Comp, San",,1967,10285667,Rock,2024-01-12 13:51:50,Fair (F),, Noisy
OC 40599,Pink Floyd,A Momentary Lapse Of Reason,Columbia,"LP, Album, Car",,1987,12541694,Rock,2024-09-18 08:44:58,Very Good Plus (VG+),,
PC 35453,Bob Dylan,Street-Legal,Columbia,"LP, Album, RE, Car",,0,2808037,Rock,2024-10-10 11:12:48,Very Good (VG),,
QC 38504,Journey,Frontiers,Columbia,"LP, Album, Pit",,1983,1455421,Rock,2024-07-16 19:03:39,Very Good Plus (VG+),,
TC 37408,Journey,Escape,Columbia,"LP, Album, Jac",,1981,10741228,Rock,2024-05-29 08:50:04,Very Good (VG),,
C 64200,Pink Floyd,The Division Bell,Columbia (2),"LP, Album, RE, Unofficial, Gat",,2021,22382788,Rock,2024-03-09 10:46:23,Near Mint (NM or M-),,
M 31818,Ludwig van Beethoven / Eugene Ormandy / The Philadelphia Orchestra / Mormon Tabernacle Choir,"Symphony No. 9 In D Minor, Op. 125",Columbia Masterworks,"LP, Album",,1973,1878260,Classical,2024-01-08 15:23:44,Very Good (VG),,
ML 4176,"Sergei Vasilyevich Rachmaninoff, Cyril Smith (2), Royal Liverpool Philharmonic Orchestra, Sir Malcolm Sargent","Rachmaninoff Concerto No.2 In C Minor For Piano And Orchestra, Op. 18",Columbia Masterworks,"LP, Mono",,1949,5931110,Classical,2024-01-08 16:49:55,Fair (F),,Noisy. Static and pops. 
ML 4277,Oscar Levant,Levant Plays Debussy,Columbia Masterworks,LP,,0,13034954,Classical,2024-01-08 16:26:16,Fair (F),,Noisy
ML 5574,"Johannes Brahms - Bruno Walter, Columbia Symphony Orchestra",Symphony No. 3 In F Major / Variations On A Theme By Haydn,Columbia Masterworks,"LP, Album, Mono",,1961,3755901,Classical,2024-01-26 19:38:22,Good (G),,
MS 6156,"Rudolf Serkin / Johannes Brahms, The Philadelphia Orchestra / Eugene Ormandy",Piano Concerto No. 2,Columbia Masterworks,"LP, Album",,1960,8057121,Classical,2024-02-28 09:09:24,Fair (F),,
MS 7031,Gioacchino Rossini - George Szell / The Cleveland Orchestra,Rossini Overtures,Columbia Masterworks,"LP, Album",,1967,3226867,Classical,2024-01-10 19:00:54,Good (G),,
MS 7093,"Igor Stravinsky, Columbia Symphony Orchestra / Columbia Chamber Ensemble",Stravinsky Conducts Histoire Du Soldat Suite / Pulcinella Suite,Columbia Masterworks,"LP, Album, Comp",,1968,3170239,Classical,2024-01-10 18:43:30,Very Good (VG),,
MS 7208,"Antonín Dvořák – George Szell, The Cleveland Orchestra",The Slavonic Dances (Complete),Columbia Masterworks,LP,,1965,3742450,Classical,2024-01-26 18:58:51,Good Plus (G+),,
"GB-6, GB 6",Various,The Sound Of Genius,"Columbia Masterworks, Columbia Masterworks","LP, Comp, Mono, Club, Ltd",,1960,1944547,Classical,2024-01-10 08:55:46,Good (G),,Little noisy and poppy
"D3S 758, MS 6972, MS 6973, MS 6974","Johannes Brahms - George Szell, The Cleveland Orchestra",Johannes Brahms: The Four Symphonies,"Columbia Masterworks, Columbia Masterworks, Columbia Masterworks, Columbia Masterworks","3xLP, RE + Box",,0,17203096,Classical,2024-01-26 19:27:15,Very Good (VG),,
P2S 5510,Various,The Fabulous 50s,Columbia Musical Treasuries,"2xLP, Comp",,1977,2949232,Uncategorized,2024-01-08 17:17:31,,,
19658-82184-2,Tenille Townes,The Worktapes,Columbia Nashville,LP,,2023,28674229,Folk / Country,2024-02-28 09:04:27,Near Mint (NM or M-),,
Y 34603,"Budapest String Quartet, Felix Mendelssohn-Bartholdy / Robert Schumann",Quartet In D Major / Quartet In A Minor,Columbia Odyssey,"LP, Album, Mono, Pit",,1977,5834205,Classical,2024-07-20 16:14:07,Very Good (VG),,
"88985365071, C-176553",Leonard Cohen,You Want It Darker,"Columbia, Columbia","LP, Album",,2016,9466485,Rock,2024-04-28 17:25:02,Near Mint (NM or M-),,
"PC2 36183, 36183",Pink Floyd,The Wall,"Columbia, Columbia","2xLP, Album, San",,1979,526569,Rock,2024-03-21 10:29:20,Fair (F),,
"SCX 6351, 1E 062 o 90496",Jeff Beck Group,Beck-Ola,"Columbia, Columbia","LP, Album",,1969,2768038,Rock,2024-02-04 17:58:32,Very Good (VG),,
19075950871,Miles Davis,A Tribute To Jack Johnson,"Columbia, Legacy","LP, Album, RE, 180",,2020,15040426,Jazz,2024-02-28 09:28:10,Near Mint (NM or M-),,
CRI SD 247,Dane Rudhyar / Ruth Crawford Seeger,Paeans / Stars / Granites / Piano Works,Composers Recordings Inc. (CRI),LP,,1969,4057880,Classical,2024-07-20 16:16:09,Very Good (VG),,
"CS-215, CS 215, CS215","The Fine Arts Quartet, Wolfgang Amadeus Mozart, Samuel Baron",The Four Flute Quartets,"Concert-Disc, Concert-Disc, Concert-Disc",LP,,1961,3960784,Classical,2024-01-26 19:02:12,Very Good (VG),,
DGRLP2307,Miles Davis,Kind Of Blue,Danger Grooves Records,"LP, Album, RE, Unofficial, Yel",,2023,28148485,Jazz,2024-02-28 09:29:17,Near Mint (NM or M-),,
"DH 56 870, WB 56 870, DHK 3492",George Harrison,Somewhere In England,"Dark Horse Records, Dark Horse Records, Dark Horse Records","LP, Album",,1981,1691685,Rock,2024-04-28 15:39:05,Good Plus (G+),,
DL 74569,Bert Kaempfert & His Orchestra,Blue Midnight And Other Fabulous Instrumentals,Decca,"LP, Album",,1964,1498836,Classical,2024-02-28 09:12:22,Fair (F),,
DL 9867,Carl Seemann,Carl Seemann Plays Piano Sonatas of Mozart,Decca,LP,,1956,9070812,Classical,2024-05-24 09:47:37,Very Good Plus (VG+),,
139 021,"Ludwig Van Beethoven, Christian Ferras, Herbert von Karajan, Berliner Philharmoniker",Violin Concerto,Deutsche Grammophon,"LP, Pre",,0,7184944,Classical,2024-07-20 16:15:07,Very Good (VG),,
410 035-1,"Wolfgang Amadeus Mozart  -  Rudolf Serkin, London Symphony Orchestra & Claudio Abbado",Klavierkonzerte = Piano Concertos Nos. 27 & 8,Deutsche Grammophon,LP,,1984,5156122,Classical,2024-01-20 10:09:09,Fair (F),,First song has one part that loops
DS 2175,Frank Zappa,Apostrophe ('),Discreet,"LP, Album, San",,1974,4951944,Rock,2024-04-19 10:19:18,Good (G),,
DSK 2291,Frank Zappa,Studio Tan,Discreet,"LP, Album, Win",,1978,993573,Rock,2024-04-28 15:36:28,Good (G),,
DSK 2292,Frank Zappa,Sleep Dirt,Discreet,"LP, Album, Win",,1979,941960,Rock,2024-07-20 16:47:05,Very Good Plus (VG+),,
DLP3774,Lawrence Welk,Winchester Cathedral,Dot Records,"LP, Mono",,1966,5455392,Other,2024-05-24 09:59:29,Very Good Plus (VG+),,
DDW027,Yowler,The Offer,Double Double Whammy,"LP, Album",,2017,10717745,Uncategorized,2024-05-17 08:34:17,Near Mint (NM or M-),,
DDW037,Eskimeaux,Year Of The Rabbit,Double Double Whammy,"LP, S/Sided, MiniAlbum, Etch, Dou",,2016,8879517,Indie,2024-05-17 08:47:03,Near Mint (NM or M-),,
DDW039,Bellows (4),Fist & Palm,Double Double Whammy,"LP, Album, Bon",,2016,9156183,Indie,2024-05-17 08:45:01,Near Mint (NM or M-),,
DDW053,Yowler,Black Dog In My Path,Double Double Whammy,"LP, Album, Bla",,2018,12811644,Indie,2024-05-17 08:37:42,Near Mint (NM or M-),,
DDW058,The Glow (4),Am I,Double Double Whammy,"LP, Album, Bab",,2019,13738508,Indie,2024-05-17 08:40:16,Near Mint (NM or M-),,
DDW059,Gemma (18),Feeling's Not A Tempo,Double Double Whammy,"LP, Album, Ltd, Bon",,2019,13711290,Indie,2024-05-17 08:41:54,Near Mint (NM or M-),,
"0-20193, 9 20193-0 A",King Crimson,Sleepless,"EG, EG, Warner Bros. Records, Warner Bros. Records","12"", Maxi, All",,1984,777997,Rock,2024-06-04 19:55:25,Very Good Plus (VG+),,
DS 500,Judy Collins,Judy,Elektra,"LP, Comp",,1969,3887221,Folk / Country,2024-05-29 11:22:57,Very Good Plus (VG+),,
"5c 050.25610, 5C 050-25610",Focus (2),Ship Of Memories,"EMI Holland, EMI Holland","LP, Album",,1976,4489658,Rock,2024-04-19 10:25:43,Very Good (VG),,
BN 26413,Jeff Beck,Truth,Epic,"LP, Album, Ter",,1968,1420601,Rock,2024-05-01 10:03:07,Very Good Plus (VG+),,
KE 30973,Jeff Beck Group,Rough And Ready,Epic,"LP, Album, Pit",,1971,1363225,Rock,2024-03-18 15:07:49,Very Good (VG),,
KE 31331,Jeff Beck Group,Jeff Beck Group,Epic,"LP, Album",,1972,11049100,Rock,2024-05-26 17:26:15,Very Good Plus (VG+),,
PE 33409,Jeff Beck,Blow By Blow,Epic,"LP, Album",,1975,1562901,Rock,2024-02-02 16:13:11,Mint (M),,
19658804921,Jeff Beck,Wired,"Epic, Legacy","LP, Album, RE",,2023,28345153,Rock,2024-01-26 19:44:40,Near Mint (NM or M-),,
SDBR 3054,Dmitri Shostakovich / Sergei Prokofiev - Sir Malcolm Sargent Conducting The London Symphony Orchestra,Symphony #9 / Lieutenant Kije Suite,Everest,"LP, Album, Sil",,1960,23192045,Classical,2024-01-26 19:16:09,Very Good (VG),,
SDBR 3079,Jorge Bolet / Frédéric Chopin,A Chopin Piano Recital,Everest,LP,,1961,5671584,Classical,2024-01-20 10:33:49,Very Good (VG),,
88697 62396 1,The Jimi Hendrix Experience,Axis: Bold As Love,"Experience Hendrix, Legacy","LP, Album, RE, RM, 180",,2010,2237319,Rock,2024-02-28 09:24:18,Near Mint (NM or M-),,
FEAR01842,Underoath,Voyeurist,Fearless Records,"LP, Album, Met",,2022,21680926,Metal,2024-02-02 16:14:37,Mint (M),,
none,Scandroid,The Darkness And The Light,FiXT,"2xLP, Album, Ltd, Bla",,2023,26295962,Rock,2024-07-05 13:43:09,Near Mint (NM or M-),,
GHS 2008,Asia (2),Asia,Geffen Records,"LP, Album, All",,1982,706690,Rock,2024-07-16 18:47:11,Very Good Plus (VG+),,
GHS 4008,Asia (2),Alpha,Geffen Records,"LP, Album, Win",,1983,5219976,Rock,2024-07-16 18:50:08,Very Good Plus (VG+),,
GHSP 2023,John Lennon,The John Lennon Collection,Geffen Records,"LP, Comp, Ltd, Promo, Qui",,1982,4304458,Rock,2024-03-21 10:35:25,Very Good Plus (VG+),,
GR1117,Petra (9),Not Of This World,Girder Records,"CD, Album, RE, RM",,2021,21048961,Rock,2024-02-04 17:24:24,Very Good (VG),,
GMS 1052,Pine Island,No Curb Service Anymore,Green Mountain Records,"LP, Album",,1976,5896714,Folk / Country,2024-01-26 19:31:42,Very Good (VG),,
SMAS-11163,Pink Floyd,The Dark Side Of The Moon,Harvest,"LP, Album, Win",,1973,367104,Rock,2024-03-18 12:05:14,Good (G),,
SMAS-832,Pink Floyd,Meddle,Harvest,"LP, Album",,1971,1562683,Rock,2024-03-21 10:19:35,Fair (F),,
ST-11078,Pink Floyd,Obscured By Clouds,Harvest,"LP, Album, Win",,1972,389668,Rock,2024-05-26 17:23:07,Very Good Plus (VG+),,
"SHVL 815, 0C 064-98 434",Pink Floyd,Animals,"Harvest, Harvest","LP, Album, Gat",,1977,391322,Rock,2024-03-18 12:18:49,Fair (F),,
DC0010LP,Dashboard Confessional,All The Truth That I Can Tell,Hidden Note Records,"LP, Album",,2022,22457737,Rock,2024-01-10 15:15:30,Mint (M),,
"B0033937-01, B0033560-01",Kacey Musgraves,Star-Crossed,"Interscope Records, MCA Nashville","LP, Album, Blu",,2021,20188507,Rock,2024-03-21 10:15:54,Near Mint (NM or M-),,
JXS 7024,Camel,Moonmadness,Janus Records,"LP, Album, Gat",,1976,6158626,Rock,2024-07-20 16:37:46,Good Plus (G+),,
JXS-7035,Camel,Rain Dances,"Janus Records, Gama (3)","LP, Album, GRT",,1977,2143972,Rock,2024-07-20 16:36:17,Very Good Plus (VG+),,
88843059851,The Jimi Hendrix Experience,Are You Experienced,"Legacy, Experience Hendrix","LP, Album, RE, RM, RP, 180",,2014,8541806,Rock,2024-03-09 10:44:34,Near Mint (NM or M-),,
LVR03263,Ghost (32),Phantomime ,Loma Vista,"12""",,2023,27131199,Rock,2024-01-25 08:05:01,Near Mint (NM or M-),Near Mint (NM or M-),
PS 656,ZZ Top,Fandango!,London Records,"LP, Album, Ter",,1975,1210423,Rock,2024-05-26 17:46:16,Very Good Plus (VG+),,
SP 44109,Harry James (2),The Golden Trumpet Of Harry James,London Records,"LP, Album, GAT",,1968,3716171,Jazz,2024-05-29 14:37:39,Very Good Plus (VG+),,
"M 7636 1, M76361",Levara,Levara,"Mascot Records (2), Mascot Records (2)","LP, Album, Blu",,2021,18697696,Rock,2024-01-25 08:08:32,Near Mint (NM or M-),,
CA12,Third Eye Blind,Dopamine,Mega Collider Records,"LP, Album, Whi + 7"", Whi",,2015,7714285,Rock,2024-01-25 08:05:58,Near Mint (NM or M-),,
TEB01LP,Third Eye Blind,Ursa Major,Mega Collider Records,"LP, Album, Ltd, RE, RP, Red",,2023,27348429,Rock,2024-01-08 17:28:27,Mint (M),,
SR-40254,"Franz Schubert, Sviatoslav Richter","Sonata in C Minor D.958, Impromptu in A Flat, Op. 142 No. 2",Melodiya/Angel,LP,,1974,8451336,Classical,2024-01-08 10:03:44,Very Good Plus (VG+),,
SR 61319,Uriah Heep,Salisbury,Mercury,"LP, Album, T -",,1971,1420341,Rock,2024-07-20 16:39:36,Very Good (VG),,
SRM-1-1046,Rush,Caress Of Steel,Mercury,"LP, Album, Gat",,1975,1652793,Rock,2024-04-28 15:35:35,Good (G),,
SRW 18066,"Yuri Boukoff, Wiener Symphoniker, László Somogyi, Franz Liszt",Liszt Piano Concertos No. 1 & 2,Mercury Wing,"LP, Album",,0,11629991,Classical,2024-02-04 18:00:33,Very Good (VG),,
B0031348-01,Marvin Gaye,Number 1's,"Motown, UMe","LP, Album, Comp, Ltd, RE, Pur",,2020,14688421,Other,2024-02-02 16:11:34,Mint (M),,
"PAS 10012, 0C 064-60 521",Wings (2),London Town,"MPL (2), MPL (2)","LP, Album",,1978,1411640,Rock,2024-04-19 10:20:17,Very Good (VG),,
MHS 3297,Johann Sebastian Bach,"Cantata No. 208, Was Mir Behagt, Ist Nur Die Muntre Jagd (""Hunt"" Cantata)",Musical Heritage Society,"LP, RE",,0,9669020,Classical,2024-01-26 19:08:12,Very Good (VG),,
MHS 3540,"Antonio Vivaldi, I Solisti Veneti, Claudio Scimone","Six Concerti, Op. XII",Musical Heritage Society,"LP, RE",,1977,12730618,Classical,2024-07-20 16:10:16,Very Good (VG),,
MHS 3641,"Johann Sebastian Bach − Indiana University Chamber Singers, Bachcollegium Stuttgart, Helmuth Rilling",Cantata No. 21 Ich Hatte Viel Bekümmernis For The Third Sunday After Trinity,Musical Heritage Society,LP,,1977,6516618,Classical,2024-01-19 08:50:24,Fair (F),,Lots of vocal. Distorted vocal. 
MHS 3863,"Frédéric Chopin, Joela Jones, Royal Philharmonic Orchestra, Paul Freeman (3)","Piano Concerto No. 2 In F Minor, Op. 21 / Etude In F Minor, Op. 10, No. 9 / Ballade In F Major, Op. 38 / Nocturne In D-flat Major Op. 27, No. 2",Musical Heritage Society,"LP, Album",,1978,4005776,Classical,2024-07-20 16:19:34,Very Good Plus (VG+),,
MHS 4001,"Johannes Brahms, Martino Tirimo, London Philharmonic Orchestra, Yoel Levi","Piano Concerto No. 2 In B-Flat Major, Op. 83",Musical Heritage Society,"LP, Album",,1979,8017178,Classical,2024-07-20 16:13:04,Very Good (VG),,
H-71191,"Joseph Haydn, The Little Orchestra Of London, Leslie Jones",Symphony No. 90 In C Major / Symphony No. 91 In E-Flat Major,Nonesuch,LP,,1966,3329047,Classical,2024-01-26 19:10:25,Very Good (VG),,
PPSD-98005,Nektar,Down To Earth,Passport Records,"LP, Album, Ter",,1975,795463,Rock,2024-10-07 13:39:38,Very Good Plus (VG+),,
817-09,Garth Brooks,The Chase,Pearl Records (8),"LP, Album, RE",,2019,18795448,Rock,2024-06-14 10:53:00,Very Good Plus (VG+),,
817-12,Garth Brooks,Triple Live,Pearl Records (8),"3xLP, Album, ""Ya",,2020,19485229,Folk / Country,2024-08-14 09:17:21,Very Good Plus (VG+),,
848-08,Garth Brooks,No Fences,Pearl Records (8),"LP, Album, Ltd, Num, RE, RM",,2019,22096537,Folk / Country,2024-05-29 08:46:57,Very Good Plus (VG+),,
"800-10, 800-03",Garth Brooks,In Pieces,"Pearl Records (8), Pearl Records (8)","LP, Album",,2019,16404225,Folk / Country,2024-07-05 13:20:06,Very Good Plus (VG+),,
PR-5,"James Boyk, Ludwig van Beethoven",Pianist in Concert,Performance Recordings,"LP, Album",,0,11352705,Classical,2024-01-08 09:56:40,Near Mint (NM or M-),,1984 PRess
PC-4026,Pyotr Ilyich Tchaikovsky - William Steinberg Conducting Pittsburgh Symphony Orchestra,Symphony No. 6 In B Minor (Pathetique),Pickwick/33 Records,"LP, Mono",,0,4433496,Classical,2024-01-26 19:25:53,Very Good (VG),,
SPC-4030,"Sergei Vasilyevich Rachmaninoff, Leonard Pennario, Saint Louis Symphony Orchestra Conducted By Vladimir Golschmann",Second Piano Concerto,Pickwick/33 Records,"LP, Album, RP",,0,7509302,Classical,2024-04-19 10:36:49,Fair (F),,
PFRLP10,Pink Floyd,Animals,Pink Floyd Records,"LP, Album, RE, RM, Gat",,2016,9431705,Rock,2024-05-01 10:09:40,Near Mint (NM or M-),,
"PFRLP12, 88875184291",Pink Floyd,The Final Cut,"Pink Floyd Records, Pink Floyd Records","LP, Album, RE, RM, 180",,2017,9704521,Rock,2024-05-16 10:40:41,Near Mint (NM or M-),,
"PFRLP9, 88875184261",Pink Floyd,Wish You Were Here,"Pink Floyd Records, Pink Floyd Records","LP, Album, RE, RM, 180",,2016,9981969,Rock,2024-05-03 21:04:40,Near Mint (NM or M-),,
